{
  "$schema": "https://json-schema.org/draft/2020-12/schema",
  "type": "object",
  "properties": {
    "apiVersion": {
      "type": "string",
      "const": "kernel-zero.dev/v1"
    },
    "kind": {
      "type": "string",
      "const": "PythonPolicy"
    },
    "metadata": {
      "type": "object",
      "properties": {
        "name": {
          "type": "string",
          "minLength": 3,
          "maxLength": 64,
          "pattern": "^[a-z0-9]+(?:-[a-z0-9]+)*$"
        },
        "revision": {
          "type": "integer",
          "minimum": 1,
          "maximum": 9007199254740991
        },
        "description": {
          "type": "string",
          "minLength": 1,
          "maxLength": 500
        }
      },
      "required": [
        "name",
        "revision",
        "description"
      ],
      "additionalProperties": false
    },
    "scope": {
      "type": "object",
      "properties": {
        "include": {
          "$ref": "#/$defs/__schema0"
        },
        "exclude": {
          "$ref": "#/$defs/__schema2"
        }
      },
      "required": [
        "include",
        "exclude"
      ],
      "additionalProperties": false
    },
    "rules": {
      "minItems": 1,
      "maxItems": 500,
      "type": "array",
      "items": {
        "$ref": "#/$defs/__schema3"
      }
    }
  },
  "required": [
    "apiVersion",
    "kind",
    "metadata",
    "scope",
    "rules"
  ],
  "additionalProperties": false,
  "$defs": {
    "__schema0": {
      "minItems": 1,
      "maxItems": 100,
      "type": "array",
      "items": {
        "$ref": "#/$defs/__schema1"
      }
    },
    "__schema1": {
      "type": "string",
      "minLength": 1,
      "maxLength": 500
    },
    "__schema2": {
      "minItems": 0,
      "maxItems": 100,
      "type": "array",
      "items": {
        "$ref": "#/$defs/__schema1"
      }
    },
    "__schema3": {
      "type": "object",
      "properties": {
        "id": {
          "type": "string",
          "minLength": 3,
          "maxLength": 80,
          "pattern": "^[a-z0-9]+(?:-[a-z0-9]+)*$"
        },
        "title": {
          "type": "string",
          "minLength": 1,
          "maxLength": 120
        },
        "level": {
          "type": "string",
          "enum": [
            "error",
            "warning"
          ]
        },
        "check": {
          "oneOf": [
            {
              "type": "object",
              "properties": {
                "kind": {
                  "type": "string",
                  "const": "forbid-import-edge"
                },
                "from": {
                  "$ref": "#/$defs/__schema0"
                },
                "deny": {
                  "minItems": 1,
                  "maxItems": 100,
                  "type": "array",
                  "items": {
                    "$ref": "#/$defs/__schema4"
                  }
                }
              },
              "required": [
                "kind",
                "from",
                "deny"
              ],
              "additionalProperties": false
            },
            {
              "type": "object",
              "properties": {
                "kind": {
                  "type": "string",
                  "const": "require-import"
                },
                "files": {
                  "$ref": "#/$defs/__schema0"
                },
                "module": {
                  "$ref": "#/$defs/__schema4"
                }
              },
              "required": [
                "kind",
                "files",
                "module"
              ],
              "additionalProperties": false
            },
            {
              "type": "object",
              "properties": {
                "kind": {
                  "type": "string",
                  "const": "restrict-call-site"
                },
                "callee": {
                  "minItems": 1,
                  "maxItems": 100,
                  "type": "array",
                  "items": {
                    "$ref": "#/$defs/__schema5"
                  }
                },
                "allowFrom": {
                  "$ref": "#/$defs/__schema2"
                }
              },
              "required": [
                "kind",
                "callee",
                "allowFrom"
              ],
              "additionalProperties": false
            },
            {
              "type": "object",
              "properties": {
                "kind": {
                  "type": "string",
                  "const": "require-context-parameter"
                },
                "files": {
                  "$ref": "#/$defs/__schema0"
                },
                "symbols": {
                  "type": "string",
                  "minLength": 1,
                  "maxLength": 500
                },
                "parameter": {
                  "type": "string",
                  "minLength": 1,
                  "maxLength": 200,
                  "pattern": "^[A-Za-z_][A-Za-z0-9_]*$"
                }
              },
              "required": [
                "kind",
                "files",
                "symbols",
                "parameter"
              ],
              "additionalProperties": false
            }
          ]
        },
        "remediation": {
          "type": "string",
          "minLength": 1,
          "maxLength": 500
        }
      },
      "required": [
        "id",
        "title",
        "level",
        "check",
        "remediation"
      ],
      "additionalProperties": false
    },
    "__schema4": {
      "type": "string",
      "minLength": 1,
      "maxLength": 300,
      "pattern": "^[A-Za-z_][A-Za-z0-9_]*(?:\\.[A-Za-z_][A-Za-z0-9_]*)*$"
    },
    "__schema5": {
      "type": "string",
      "minLength": 1,
      "maxLength": 300,
      "pattern": "^[A-Za-z_][A-Za-z0-9_]*(?:\\.[A-Za-z_][A-Za-z0-9_]*)*$"
    }
  }
}
