{"apiVersion":"kernel-zero.dev/v1","kind":"PythonPolicy","metadata":{"description":"Python architecture boundaries","name":"python-boundaries","revision":1},"rules":[{"check":{"deny":["subprocess"],"from":["src/api/**/*.py"],"kind":"forbid-import-edge"},"id":"api-no-processes","level":"error","remediation":"Call the isolated worker boundary.","title":"API cannot launch processes"}],"scope":{"exclude":["**/tests/**"],"include":["src/**/*.py"]}}
